Assignment 15

mysql> select * from customers;
+------+----------+----------+--------+------+
| Cnum | Cname    | City     | Rating | Snum |
+------+----------+----------+--------+------+
| 2001 | Hoffman  | London   |    100 | 1001 |
| 2002 | Giovanni | Rome     |    300 | 1003 |
| 2003 | Liu      | San Jose |    200 | 1004 |
| 2004 | Grass    | Berlin   |    300 | 1004 |
| 2006 | Clemens  | London   |    100 | 1001 |
| 2008 | Cisneros | San Jose |    300 | 1007 |
| 2007 | Pereira  | Rome     |    200 | 1004 |
+------+----------+----------+--------+------+

mysql> select * from salespeople;
+------+---------+-----------+------+
| Snum | Sname   | City      | Comm |
+------+---------+-----------+------+
| 1001 | Peel    | London    | 0.12 |
| 1002 | Serres  | San Jose  | 0.13 |
| 1004 | Motika  | London    | 0.11 |
| 1007 | Rifkin  | Barcelona | 0.15 |
| 1003 | Axelrod | New York  | 0.10 |
| 1100 | Blanco  | San Jose  | NULL |
+------+---------+-----------+------+


1) Assume there is a table called Multicust, with all of the same column definitions 
as Salespeople. Write a command that inserts all salespeople with more than one 
customer into this table.

create table Multicust
as
select * from Salespeople where 1=2;
---------------------------------------

insert into Multicust
select * from salespeople
where snum in (
select snum from customers
group by snum
having count(snum) > 1);

Customers table:
+------+----------+----------+--------+------+
| Cnum | Cname    | City     | Rating | Snum |
+------+----------+----------+--------+------+
| 2001 | Hoffman  | London   |    100 | 1001 |
| 2002 | Giovanni | Rome     |    300 | 1003 |
| 2003 | Liu      | San Jose |    200 | 1004 |
| 2004 | Grass    | Berlin   |    300 | 1004 |
| 2006 | Clemens  | London   |    100 | 1001 |
| 2008 | Cisneros | San Jose |    300 | 1007 |
| 2007 | Pereira  | Rome     |    200 | 1004 |
+------+----------+----------+--------+------+

mysql> select * from multicust;
+------+--------+--------+------+
| Snum | Sname  | City   | Comm |
+------+--------+--------+------+
| 1001 | Peel   | London | 0.12 |
| 1004 | Motika | London | 0.11 |
+------+--------+--------+------+


2) Write a command that deletes all customers with no current orders.

BEFORE: 
mysql> select * from customers;
+------+----------+----------+--------+------+
| Cnum | Cname    | City     | Rating | Snum |
+------+----------+----------+--------+------+
| 2001 | Hoffman  | London   |    100 | 1001 |
| 2002 | Giovanni | Rome     |    300 | 1003 |
| 2003 | Liu      | San Jose |    200 | 1004 |
| 2004 | Grass    | Berlin   |    300 | 1004 |
| 2006 | Clemens  | London   |    100 | 1001 |
| 2008 | Cisneros | San Jose |    300 | 1007 |
| 2007 | Pereira  | Rome     |    200 | 1004 |
+------+----------+----------+--------+------+
7 rows in set (0.00 sec)

mysql> select * from orders;
+------+---------+------------+------+------+
| Onum | Amt     | Odate      | Cnum | Snum |
+------+---------+------------+------+------+
| 3001 |   18.69 | 1990-10-03 | 2008 | 1007 |
| 3003 |  767.19 | 1990-10-03 | 2001 | 1001 |
| 3002 | 1900.10 | 1990-10-03 | 2007 | 1004 |
| 3005 | 5160.45 | 1990-10-03 | 2003 | 1002 |
| 3006 | 1098.16 | 1990-10-03 | 2008 | 1007 |
| 3009 | 1713.23 | 1990-10-04 | 2002 | 1003 |
| 3007 |   75.75 | 1990-10-04 | 2004 | 1002 |
| 3010 | 1309.95 | 1990-10-06 | 2004 | 1002 |
+------+---------+------------+------+------+

AFTER:
delete from customers where cnum not in
(
select distinct cnum from orders);

mysql> select * from customers;
+------+----------+----------+--------+------+
| Cnum | Cname    | City     | Rating | Snum |
+------+----------+----------+--------+------+
| 2001 | Hoffman  | London   |    100 | 1001 |
| 2002 | Giovanni | Rome     |    300 | 1003 |
| 2003 | Liu      | San Jose |    200 | 1004 |
| 2004 | Grass    | Berlin   |    300 | 1004 |
| 2008 | Cisneros | San Jose |    300 | 1007 |
| 2007 | Pereira  | Rome     |    200 | 1004 |
+------+----------+----------+--------+------+
6 rows in set (0.00 sec)

3) Write a command that increases by twenty percent the commissions of all 
salespeople with total orders above Rs. 3,000.

BEFORE:
mysql> select * from salespeople;
+------+---------+-----------+------+
| Snum | Sname   | City      | Comm |
+------+---------+-----------+------+
| 1001 | Peel    | London    | 0.12 |
| 1002 | Serres  | San Jose  | 0.13 |
| 1004 | Motika  | London    | 0.11 |
| 1007 | Rifkin  | Barcelona | 0.15 |
| 1003 | Axelrod | New York  | 0.10 |
| 1100 | Blanco  | San Jose  | NULL |
+------+---------+-----------+------+

AFTER:

update salespeople
set comm = comm + 0.2*comm
where snum in
(
select snum from orders
group by snum
having sum(amt) > 3000
);


mysql> select * from salespeople;
+------+---------+-----------+------+
| Snum | Sname   | City      | Comm |
+------+---------+-----------+------+
| 1001 | Peel    | London    | 0.12 |
| 1002 | Serres  | San Jose  | 0.16 |
| 1004 | Motika  | London    | 0.11 |
| 1007 | Rifkin  | Barcelona | 0.15 |
| 1003 | Axelrod | New York  | 0.10 |
| 1100 | Blanco  | San Jose  | NULL |
+------+---------+-----------+------+



